{
    "cost": 120,
    "health": 80,
    "speed": {
        "road": 45,
        "off_road": 30
    },
    "armor": {
        "front": 40,
        "side": 30,
        "rear": 15,
        "top": 10
    },
    "fuel": 400,
    "autonomy": {
        "road": 400,
        "off_road": 250
    },
    "optics": "Normal",
    "stealth": "Poor",
    "forward_deploy": 0,
    "weapons": [
        {
            "weapon_id": "sdf_barrage_missile",
            "count": 1,
            "max_ammo": 4
        },
        {
            "weapon_id": "sdf_heavy_auto_cannon_hull",
            "count": 1,
            "max_ammo": 300
        }
    ]
}
