{
    "cost": 65,
    "health": 30,
    "speed": {
        "road": 110,
        "off_road": 110
    },
    "armor": {
        "front": 15,
        "side": 15,
        "rear": 10,
        "top": 10
    },
    "fuel": 400,
    "autonomy": {
        "road": 350,
        "off_road": 350
    },
    "optics": "Very Good",
    "stealth": "Medium",
    "forward_deploy": 1,
    "weapons": [
        {
            "weapon_id": "vanguard_typhoon_missile",
            "count": 1,
            "max_ammo": 12
        },
        {
            "weapon_id": "vanguard_heavy_auto_cannon",
            "count": 1,
            "max_ammo": 400
        }
    ]
}
