{
    "cost": 150,
    "health": 60,
    "speed": {
        "road": 800,
        "off_road": 800
    },
    "armor": {
        "front": 20,
        "side": 20,
        "rear": 20,
        "top": 20
    },
    "fuel": 2000,
    "autonomy": {
        "road": 2000,
        "off_road": 2000
    },
    "optics": "Very Good",
    "stealth": "Poor",
    "forward_deploy": 0,
    "weapons": [
        {
            "weapon_id": "sdf_auto_cannon_30mm_air",
            "count": 2,
            "max_ammo": 600
        },
        {
            "weapon_id": "pdf_skystrike_missile",
            "count": 4,
            "max_ammo": 4
        }
    ]
}
