{
    "cost": 60,
    "health": 10,
    "speed": {
        "road": 15,
        "off_road": 12
    },
    "armor": {
        "front": 20,
        "side": 20,
        "rear": 20,
        "top": 20
    },
    "optics": "Very Good",
    "stealth": "Poor",
    "forward_deploy": 0,
    "weapons": [
        {
            "weapon_id": "vanguard_heavy_laser_cannon",
            "count": 4,
            "max_ammo": 40
        },
        {
            "weapon_id": "vanguard_kinetic_rifle",
            "count": 1,
            "max_ammo": 100
        }
    ]
}
