{
    "cost": 130,
    "health": 50,
    "speed": {
        "road": 400,
        "off_road": 400
    },
    "armor": {
        "front": 15,
        "side": 15,
        "rear": 10,
        "top": 10
    },
    "fuel": 1000,
    "autonomy": {
        "road": 800,
        "off_road": 800
    },
    "optics": "Very Good",
    "stealth": "Medium",
    "forward_deploy": 0,
    "weapons": [
        {
            "weapon_id": "sdf_tank_hunter_laser",
            "count": 1,
            "max_ammo": 40
        },
        {
            "weapon_id": "pdf_hellstrike_missile",
            "count": 2,
            "max_ammo": 2
        }
    ]
}
