{
    "cost": 320,
    "health": 350,
    "speed": {
        "road": 40,
        "off_road": 35
    },
    "armor": {
        "front": 250,
        "side": 250,
        "rear": 250,
        "top": 100
    },
    "fuel": 500,
    "autonomy": {
        "road": 300,
        "off_road": 200
    },
    "optics": "Very Good",
    "stealth": "None",
    "forward_deploy": 0,
    "weapons": [
        {
            "weapon_id": "vanguard_twin_heavy_laser_cannon",
            "count": 2,
            "max_ammo": 100
        },
        {
            "weapon_id": "vanguard_twin_heavy_auto_cannon",
            "count": 1,
            "max_ammo": 1000
        },
        {
            "weapon_id": "vanguard_twin_kinetic_rifle",
            "count": 1,
            "max_ammo": 400
        }
    ]
}
